{
  "schema_version": 1,
  "work_item_id": "inspect-source",
  "attempt": 1,
  "auditor_id": "auditor-inspect-source-1-8ca12d85",
  "executor_id": "executor-inspect-source-1-b9530574",
  "status": "accepted",
  "integrity": "clean",
  "contract_alignment": "aligned",
  "evidence": [
    "FastCtx glob found exactly one matching file at inspected relative path e2e-source.txt: E:/code_space/agent-space/multi-teammates-agents/tests/model-e2e-workspace/e2e-source.txt.",
    "FastCtx read of e2e-source.txt completed successfully and showed line 1 as expert-team-e2e-v1 and line 2 blank.",
    "Exact observed trimmed content: expert-team-e2e-v1."
  ],
  "findings": [],
  "required_rework": []
}
