{
  "schema_version": 1,
  "work_item_id": "verify-source",
  "attempt": 1,
  "auditor_id": "auditor-verify-source-1-4b0322f5",
  "executor_id": "executor-verify-source-1-19b91e32",
  "status": "accepted",
  "integrity": "clean",
  "contract_alignment": "aligned",
  "evidence": [
    "FastCtx glob in E:/code_space/agent-space/multi-teammates-agents/tests/model-e2e-workspace found exactly one matching file: e2e-source.txt.",
    "FastCtx read of e2e-source.txt completed and showed line 1 as expert-team-e2e-v1 with only a trailing blank line from the final newline.",
    "FastCtx hex read showed bytes 65 78 70 65 72 74 2d 74 65 61 6d 2d 65 32 65 2d 76 31 0a, confirming exact LF content expert-team-e2e-v1 followed by a single newline and no extra bytes.",
    "Dependency consistency is aligned with the authoritative input: the verified artifact is the required relative path e2e-source.txt and its trimmed content is exactly expert-team-e2e-v1."
  ],
  "findings": [],
  "required_rework": []
}
